Classification,Summary
Add issue,The documentation comment for getVariable/getParamVariable is inaccurate.
Add issue,The documentation comment for the getVariable/getParamVariable is inaccurate.
Add issue,The documentation comment for getVariable/getParamVariable is inaccurate.
Add issue,"""Improper documentation comment for the functions getVariable/getParamVariable"""
Add issue,The error reporting for the command 'svn status' needs to be improved.
Add issue,"""Improved error reporting is required for the 'svn status' command."""
Add issue,The 'svn status' command requires improved error notification.
Add issue,It is necessary for 'svn status' to have improved error notification.
Add issue,Multi-language assistance when converting xml to pdf.
Add issue,Adjusting XML documents to PDF format with assistance for multiple languages.
Add issue,Assistance for multiple languages in the conversion of xml to pdf.
Add issue,Assistance for multiple languages in the conversion of xml to pdf.
Add issue,Velocity needs to offer a means to access properties directly through an interface.
Add issue,Velocity needs to offer a means for explicitly retrieving properties through a designated interface.
Add issue,Velocity needs to offer a means of accessing properties directly through an interface.
Add issue,The interface of Velocity needs to allow for the retrieval of specific properties.
Add issue,Convert svn-ref.tex into French.
Add issue,Convert svn-ref.tex into French.
Add issue,Convert svn-ref.tex into French language.
Add issue,'Render svn-ref.tex in French'
Add issue,Improved options for personalizing the schedule element.
Add issue,improved customization options for the schedule element
Add issue,Improved options for personalization in the schedule feature
Add issue,improved customization options for the schedule feature
Add issue,Apache 2.2 is currently not supported.
Add issue,Apache 2.2 is not currently supported.
Add issue,Apache 2.2 is currently not supported.
Add issue,Apache 2.2 is not currently supported.
Add issue,'compile tips for avoiding common JUnit errors'
Add issue,'Beware of JUnit traps'
Add issue,"""Outline potential issues with using JUnit"""
Add issue,"Very important topics to keep in mind when using JUnit

Cautionary points to consider while utilizing JUnit."
Add issue,'Maximum buffer size for HTTP header must be raised to 64k from its current limit of 16k.'
Add issue,'Requirement to raise the upper limit of buffer size for HTTP header from 16k to 64k.'
Add issue,There is a requirement to raise the maximum capacity of the HTTP header buffer from 16k to 64k.
Add issue,It is necessary to raise the upper limit for the HTTP header buffer size from 16k to 64k.
Add issue,Include error messages in the rasterizer.
Add issue,Include print statements for errors in the rasterizer.
Add issue,Include error messages in the rasterizer.
Add issue,Include error message displays in rasterization.
Add issue,Require the capability to alter the designated port number for HTTP.
Add issue,Require the capability to modify the port number for HTTP.
Add issue,Require the capability to modify the port number used for HTTP.
Add issue,'Require the capacity to modify the port number used for HTTP.'
Add issue,The parameter support/property BugRat Report#350 is required by RMIC for debugging purposes.
Add issue,It is necessary for RMIC to have support for debug generation parameters/property in order to fix BugRat Report#350.
Add issue,The support/property BugRat Report#350 is required for the generation of debugging parameters for RMIC.
Add issue,RMIC requires parameter support for generating debug information for property BugRat Report number 350.
Add issue,"Require the capability to establish a ""plan"" for SSL offloading."
Add issue,"Require the capability to establish a ""plan"" for SSL offloading."
Add issue,"Requirement to have the capability of configuring the ""scheme"" for SSL offloading."
Add issue,"Require the capability to establish a ""scheme"" for SSL offloading."
Add issue,Change the exceptions from fop 0.95 to 1.0.
Add issue,Update the differences in fop 0.95 to 1.0.
Add issue,Update exemptions from fop 0.95 to 1.0.
Add issue,"""Enhance the exclusions process from fop version 0.95 to 1.0"""
Add issue,Metrics are necessary for Type 1 fonts in order to accurately display accentuated characters.
Add issue,Metrics required for Type 1 fonts to include emphasized characters
Add issue,Accented characters require metrics when using Type 1 fonts.
Add issue,Metrics are necessary for Type 1 fonts in order to include emphasized characters.
Add issue,The compliance page requires updating.
Add issue,The conformity page requires updating.
Add issue,The compliance page requires updating.
Add issue,The compliance page requires updating.
Add issue,Include management of the ZoomAndPan property.
Add issue,Include the capability to manage the ZoomAndPan property
Add issue,Include functionality for the ZoomAndPan setting.
Add issue,Include implementation for the ZoomAndPan parameter.
Add issue,Implement overflow functionality for clip-path.
Add issue,Include the ability to handle overflow when using clip-path.
Add issue,Include the ability to handle overflow in clip-path feature.
Add issue,Provide assistance for overflow on clip-path.
Add issue,[UPDATE] A software tool for examining code and tracking its coverage
Add issue,'A tool for code analysis with a focus on code coverage [PATCH]'
Add issue,'[UPDATE] A software tool for analyzing code coverage and conducting code analysis.'
Add issue,[UPDATE] An analysis tool for evaluating code coverage
Add issue,"The optional tasks provided by Ant1,2 are not compatible with JUnit 3.5 and cannot be compiled."
Add issue,"The optional tasks for Ant1,2 cannot be compiled with JUnit version 3.5."
Add issue,"The optional tasks for Ant1,2 cannot be compiled with JUnit 3.5."
Add issue,"Ant1,2's additional assignments cannot be compiled with JUnit 3.5."
Add issue,Include a metrics-version attribute in the XML font metrics file
Add issue,Include the metrics-version attribute in the XML font metrics file.
Add issue,Include a metrics-version attribute in the XML font metrics file.
Add issue,Include the metrics-version attribute in the XML file containing font metrics.
Add issue,The documentation for JK Apache HowTo lacks information on how to use the --enable-prefork feature of the configure script.
Add issue,The documentation for JK Apache HowTo fails to provide an explanation for the --enable-prefork setting in the configure script.
Add issue,The documentation for JK Apache HowTo does not provide an explanation for the configure script's --enable-prefork option.
Add issue,The HowTo documentation for JK Apache does not provide an explanation for the --enable-prefork option in the configure script.
Add issue,[UPDATE] Update to Java 1.5 - Included type-safe parameters for collections in Fonts.
Add issue,'[UPDATE] Enhance to Java 1.5 - Implemented type-safe parameters for collections in Fonts'
Add issue,'[UPGRADE] Java 1.5 upgrade - Implemented type-safe parameters for collections in the Fonts section'
Add issue,[UPDATE] Java version 1.5 now implemented - Included secure parameters for collections in Fonts.
Add issue,Changes to Apache XML Graphics Mission Statement
Add issue,Revisions to Apache XML Graphics Bylaws
Add issue,Revisions to the Apache XML Graphics Charter
Add issue,Revision of Apache XML Graphics Bylaws
Add issue,The process of creating a document should include verifying and alerting for any unusual characters.
Add issue,Creating a document requires the need to validate and caution against the use of special characters.
Add issue,The creation of documents should be verified and cautioned against the use of special characters.
Add issue,Creating documents should include checks to verify and alert for any special characters.
Add issue,[UPDATE] Include apr_hash_this_* compatibility
Add issue,"""[PATCH] Implementation of apr_hash_this_* support has been included"""
Add issue,[PATCH] Incorporate assistance for apr_hash_this_*
Add issue,"""[UPDATE] Introduce backing for apr_hash_this_* task"""
Add issue,Including X509 subelements has no effect on the signing process.
Add issue,Including X509 subelements is ineffective for the purpose of signing.
Add issue,Including X509 subcomponents is ineffective for the purpose of signing.
Add issue,Including additional components of X509 is ineffective for digital authentication.
Add issue,The task is not documented to be dependent on.
Add issue,Task dependency is not mentioned in the documentation.
Add issue,The task in question is not clearly outlined in the documentation.
Add issue,The task is not stated in the documentation.
Add issue,The task for labeling VSS not being adequately described.
Add issue,Information regarding VSS label task not available.
Add issue,Details about the VSS label assignment task are unavailable.
Add issue,The description of the task involving VSS labeling is absent.
Add issue,The CDT doc 'Debug Tutorial' lacks the essential component TVT3.0.
Add issue,"""TVT3.0 may be the crucial component absent from the 'Debug Tutorial' in CDT documentation."""
Add issue,TVT3.0 has been identified as the crucial element that is absent from the CDT documentation titled 'Debug Tutorial'.
Add issue,TVT3.0 is the absent element in the CDT document titled 'Debug Tutorial'.
Add issue,"After restarting the debug session, any user-made register groups will no longer be present in the register listing."
Add issue,"Upon restarting a debug session, any register groups created by the user are no longer visible."
Add issue,Sign up: groups of registered users that were created will disappear upon restarting the debugging session.
Add issue,"'Upon restarting the debug session, any register groups that were added by the user will no longer be visible.'"
Add issue,Correct errors in Phoenix's css documents and implement the ability to display greyed-out options in the left navigation menu.
Add issue,Correct any errors in Phoenix style sheets and enable the ability to display grayed-out options in the left navigation menu.
Add issue,Correct errors in the Phoenix cascading style sheets and incorporate functionality for faded left navigation menu items.
Add issue,Correct any errors in the css files of Phoenix and include the capability for left navigation menu items to appear in a greyed-out state.
Add issue,"""Top Ten Voted Issues"" should encompass RESOLVED/LATER occurrences."
Add issue,"The list of the most popular bugs, known as ""Top Ten Voted Bugs,"" ought to feature those that have been marked as RESOLVED/LATER."
Add issue,"The list of ""Top Voted Bugs"" should contain RESOLVED/LATER bugs."
Add issue,"The list of ""Top Ten Voted Issues"" should encompass those that have been marked as RESOLVED/LATER."
Add issue,Incorporate additional elements onto the timeline section.
Add issue,Include additional elements on the timeline section
Add issue,Include additional functions to the chronology section.
Add issue,Incorporate additional elements onto the timeline section of the page.
Add issue,Swapping the information within entity objects during the process of renaming a particular entity.
Add issue,"When changing the name of a specific entity, the contents of the entity objects are swapped."
Add issue,Swapping the contents of entity objects during the renaming process of a specific entity.
Add issue,Swapping entity object contents during the process of renaming a specific entity.
Add issue,Debug mode does not show any error on a missing view model.
Add issue,There is no error when the view model is missing in debug mode.
Add issue,There is no error when the view model is missing in debug mode.
Add issue,There is no mistake when the View Model is not found in Debug Mode.
Add issue,The FacesConfig Editor preferences page requires additional information to be accessible for screen readers.
Add issue,The FacesConfig Editor preferences page requires additional information to cater to users of screen readers.
Add issue,The preferences page for the FacesConfig Editor requires additional information to accommodate screen reader users.
Add issue,The preferences page for the FacesConfig Editor requires additional information to be accessible for screen readers.
Add issue,'Font in dialogs should be utilized by the jdt debug module.'
Add issue,'[Conversations] The font utilized for dialogs should be applied for the jdt debug module.'
Add issue,The JDT debug component should utilize the dialog font.
Add issue,The JDT debug component should utilize the dialog font.
Add issue,"'Correction: CfgParser has been enhanced to facilitate the resolution of environment variables, macros and include files.'"
Add issue,"Correction: ""Correction of a CfgParser issue: Enhanced functionality to address environment variables, macros, and include files."""
Add issue,"Correction: A bug has been fixed to enable the CfgParser to resolve environment variables, macros and include files."
Add issue,"Correction: A fix was made to the CfgParser that allows it to handle the resolution of environment variables, macros, and include files."
Add issue,Incorporating a section for bug reports on the website.
Add issue,Incorporating a webpage dedicated to reporting bugs on the website
Add issue,Creating a page on the website specifically for reporting bugs.
Add issue,Incorporating a page on the website for reporting bugs
Add issue,Make a servlet for the wizard.
Add issue,Generate a servlet for the Wizard feature.
Add issue,Generate a Wizard servlet.
Add issue,Generate a Wizard servlet.
Add issue,"The download page should be revised in order to eliminate the ""mandatory ws"" section."
Add issue,"The download page must be revised to eliminate the ""mandatory ws"" section."
Add issue,"The download page must be refreshed in order to delete the ""mandatory ws"" section."
Add issue,"The ""required ws"" section must be eliminated from the download page in order to update it."
Add issue,'Instruction: Include a readme entry for the Log Import issue on iSeries V4R5 (bugzilla 126792).'
Add issue,Update the README to include information about the Log Import issue on iSeries V4R5 (bugzilla 126792).
Add issue,'User Guide: Include an entry in the readme section regarding the Log Import issue for iSeries V4R5 (bugzilla 126792).'
Add issue,"""Instructions: Include a readme entry regarding the Log Import issue on iSeries V4R5 (bugzilla 126792)."""
Add issue,"""Debugging data must be included in your final build outcome."""
Add issue,Debugging details must be present in your final build output.
Add issue,The build result must include debug information.
Add issue,Debug information is required to be included in the resulting build.
Add issue,[Platform Project] Develop Bugzilla element for data analysis summaries.
Add issue,[Platform Project] Develop a Bugzilla category designated for generating statistical reports.
Add issue,[Platform Project] Establish a Bugzilla section dedicated to generating statistical reports.
Add issue,[Platform Project] Develop a Bugzilla section specifically for statistical reports.
Add issue,The launch of a java application profile should utilize the DebugPlugin.ATTR_CONSOLE_ENCODING.
Add issue,DebugPlugin.ATTR_CONSOLE_ENCODING should be utilized for launching a java application profile.
Add issue,The preferred method for initiating the startup of a java application profile is by utilizing DebugPlugin.ATTR_CONSOLE_ENCODING.
Add issue,The launch of a java application profile should utilize the attribute console encoding from the DebugPlugin.
Add issue,Implement breakpoints for support in debugging JavaScript.
Add issue,Include breakpoints for support lines in debugging for JavaScript.
Add issue,Enable breakpoints for support lines during JavaScript debugging.
Add issue,Provide assistance for breakpoints in debugging JavaScript.
Add issue,The documentation for the statistical console on M8 has been revised and updated.
Add issue,'Revisions to M8 documentation for the statistical console'
Add issue,The statistical console in the M8 documentation has been updated.
Add issue,Updates to the statistical console documentation on M8.
Add issue,Include the Find and Filter toolbars in the UML2SD view.
Add issue,Include the toolbar buttons for locating and refining in the UML2SD view.
Add issue,Add options for searching and refining in the toolbar of UML2SD view.
Add issue,Include the Find and Filter options on the toolbar in UML2SD view.
Add issue,Offer an API to establish the beginning and ending moments for executing a task.
Add issue,Present an API that allows for the execution time to be specified with a start and end time.
Add issue,Offer an API that allows for setting the initial and final time for execution.
Add issue,Offer an API for implementing the timing interval by setting the beginning and conclusion points.
Add issue,Assist in modifying Graph Node and spacing dimensions.
Add issue,Assist in adapting Graph Node and spacing dimensions.
Add issue,Assist in tailoring Graph Node and spacing dimensions.
Add issue,Assist in modifying Graph Node and adjusting spacing dimensions.
Add issue,"""Offer API for the coloring of stroke on graph nodes."""
Add issue,"""Offer an API to specify the color of stroke for graph nodes."""
Add issue,Give API to specify stroke color for graph nodes
Add issue,Furnish an API for setting the stroke color of a graph node.
Add issue,Offer an API for displaying an overlay icon on graph nodes.
Add issue,"""Include an Application Programming Interface for the icon overlay on graph nodes."""
Add issue,Give an API that enables the use of overlay icons for graph nodes.
Add issue,"""Offer an API for the overlay of icon on graph nodes."""
Add issue,"The Datapool Evaluator and Iterator extension points need to be relocated to the test.datapool package, alongside the missing extension point schemas."
Add issue,"The Evaluator and Iterator extension points of Datapool should be relocated to the test.datapool package, as well as the missing extension point schemas."
Add issue,"The Datapool Evaluator and Iterator extension points should be relocated to the test.datapool package. Additionally, the extension point schemas are currently absent."
Add issue,"The Datapool Evaluator and Iterator extension points need to be relocated to the test.datapool package. Moreover, the schemas for the extension points are currently absent."
Add issue,Require a systematic method for accessing the highlighting rectangle from the time compression bar to the desired lifeline.
Add issue,Looking for a systematic method to access the highlighted rectangle on the time compression bar and navigate to the desired lifeline.
Add issue,We require a systematic method of accessing the rectangular highlight that spans from the time compression bar to the desired lifeline.
Add issue,Require a systematic approach to access the highlighted rectangle between the time compression bar and the desired lifeline.
Add issue,Modified statistic of coverage: Refreshing filter technique.
Add issue,Statistic for Coverage: Method Filter Update
Add issue,Statistic for coverage: Method filter updated
Add issue,Statistic for Coverage: Method Filter Update
Add issue,(MON) Implement GLA filter blade to support range filtration
Add issue,(MON) Add the capability of applying a range filter to the GLA filter blade.
Add issue,Implement GLA filter blade with abilities for range filtering.
Add issue,(MON) Implement GLA filter blade range filtering options.
Add issue,Requirements for feature / issue 74652.
Add issue,Requirement for item / defect 74652
Add issue,Requirement for characteristic / glitch 74652
Add issue,Requirement for characteristic / issue number 74652
Add issue,"""Article on eclipses"""
Add issue,Article on the corner of an eclipse
Add issue,Article about the corner of the eclipse
Add issue,Article about the eclipse phenomenon
Add issue,File transferring service for enabling command version capabilities.
Add issue,[Implementation] Service for transferring files to enable support for various versions of commands.
Add issue,A service for transferring files will be provided to facilitate the use of different command versions.
Add issue,'Modification and implementation of a [deployment] file transfer system to facilitate the function of multiple command versions.'
Add issue,[Extension] Assistance with linking in test running platform for IAC and safeguarding measures.
Add issue,Enhanced capability to establish connections through the testing execution service for IAC and security.
Add issue,"""Assistance for establishing connections in the test execution service to accommodate IAC (Infrastructure as Code) and security requirements."""
Add issue,The test execution service offers extensive support for connection in IAC and security.
Add issue,Updates to the Performance section of the TPTP Tester Guide.
Add issue,Updates to the Performance chapter of the TPTP Tester Guide.
Add issue,Updates to the Performance chapter of the TPTP Tester Guide
Add issue,Updates to the Performance chapter of the TPTP Tester Guide
Add issue,"""Offer a method to set up a new AC in a way that limits its use to a predetermined group of aliases."""
Add issue,Offer a method for setting up a new AC in which it will only activate a predetermined list of aliases.
Add issue,Present a method for setting up new air conditioning units in a way that they only activate a predetermined group of shortcuts.
Add issue,"""Offer a method for configuring the freshly installed air conditioner to only activate a predetermined selection of aliases."""
Add issue,"The part of the driver related to the ""Expanding"" chapter has not been delivered."
Add issue,"""Chapter extension"" not delivered in driver."
Add issue,"The section labeled as ""Extending"" has not been included in the driver shipment."
Add issue,"""Chapter extension"" unavailable in driver delivery"
Add issue,The Log Interaction View is lacking the Extend Filter function.
Add issue,The Log Interaction View is lacking the Extend Filter function.
Add issue,The Extend Filter function is not present in the Log Interaction View.
Add issue,The Log Interaction View does not have the Extend Filter option available.
Add issue,The UML2SD Log Interaction view lacks correlations.
Add issue,There is a lack of correlations present in the UML2SD Log Interaction view.
Add issue,Correlations are absent in the UML2SD Log Interaction view.
Add issue,The UML2SD Log Interaction view lacks correlations.
Add issue,Convert all Hyades sample materials to have NL capabilities.
Add issue,Convert all Hyades demonstrations to have natural language capabilities.
Add issue,Transform all Hyades sample projects to have the capability of natural language integration.
Add issue,"""Transfer all Hyades samples to have natural language capabilities."""
Add issue,The summary is insufficiently compact.
Add issue,The overview is insufficiently compact.
Add issue,The summary is insufficiently sized.
Add issue,The overview is insufficiently compact.
Add issue,APIs for deactivating the Show Caller/Called Message functionality
Add issue,APIs for disabling the Show Caller/Called Message function
Add issue,APIs for turning off Show Caller/Called Message function.
Add issue,This refers to programming interfaces (APIs) that can turn off the function of displaying caller/called message actions.
Add issue,It is not possible to edit again a class that is a derivative of Composite.
Add issue,It is not possible to modify a composite class by re-editing it.
Add issue,Editing a class that extends Composite is not possible.
Add issue,It is not possible to edit again a class that is derived from Composite.
Add issue,Generate a Manifest file for GLA plugins.
Add issue,Generate Manifest file for GLA extensions
Add issue,Produce a Manifest file for GLA plugins.
Add issue,Generate a Manifest file for GLA plugins.
Add issue,Class templates for graphics should be included in their corresponding plugins.
Add issue,Visual class templates for new plugins must be located in their respective plugins.
Add issue,Class templates for visuals must be located in their corresponding plugins.
Add issue,Fresh graphical style templates ought to exist within corresponding plug-ins.
Add issue,Looking for a Text Editor to use with the Link Widget.
Add issue,Looking for a Text Editor for the Link Widget.
Add issue,We require a text editing tool for the link widget.
Add issue,In need of a text editor for the Link Widget.
Add issue,"Summary: This is an update to add assistance for Insiders, private remarks, private attachments, and a fix for the July 12 tip."
Add issue,Evaluation: Implement assistance for Beta Testers; Confidential notes; Confidential document attachments; Update for latest version on July 12.
Add issue,"""Revision: Implement assistance for Insiders; Confidential remarks; Confidential Attachments; Update for July 12th release"""
Add issue,"""Summary: Implementation of Insiders assistance; Confidential remarks and attachments; Update released for July 12th version"""
Add issue,"Evaluation: The addition of language support for Bugzilla templates is necessary; In the eighth edition, adjustments to eliminate unnecessary spaces and the removal of ($) prototyping have been made."
Add issue,Evaluation: Bugzilla ought to enable translated or localized templates; Release 8: Corrections made to spacing; Removal of ($) prototype.
Add issue,This review suggests that Bugzilla must have the capability to use templates that are translated or localized. The eighth version specifically addresses the issue of fixing whitespace and also mentions removing prototyping that includes a ($) symbol.
Add issue,Summary: Bugzilla needs to add support for translated templates and has made changes to fix whitespace and remove prototyping in its eighth version.
