Classification,Summary
Performance issue,Issue with the functionality of the method TypeUtil.resolveInParents().
Performance issue,The method TypeUtil.resolveInParents() is experiencing difficulties in functioning efficiently.
Performance issue,The method 'TypeUtil.resolveInParents()' is experiencing a difficulty with its functionality.
Performance issue,Difficulty with execution in the TypeUtil.resolveInParents() function.
Performance issue,There is an issue with the method TypeUtil.resolveInParents() that is affecting its performance.
Performance issue,The bug fix for EclipseME 1.7.9 should be included.
Performance issue,Incorporate the bug fix for EclipseME 1.7.9 in [eclipseme]
Performance issue,'Incorporate the bug fix for EclipseME 1.7.9 into the program.'
Performance issue,'Incorporate EclipseME 1.7.9 bug patch in [eclipseme]'
Performance issue,[Modify] Add EclipseME version 1.7.9 bug resolution.
Performance issue,'Incorporate the EclipseME version 1.7.9 bug repair into the code'
Performance issue,Please incorporate the EclipseME 1.7.9 bug fix.
Performance issue,'Add in the bug fix for EclipseME version 1.7.9'
Performance issue,Include the necessary bug fix for EclipseME version 1.7.9.
Performance issue,'Add the EclipseME 1.7.9 bug fix to [eclipseme].'
Performance issue,'Incorporate the bug fix for EclipseME 1.7.9 into the project.'
Performance issue,There is a mistake while trying to debug with xDebug.
Performance issue,Trouble encountered while debugging with xDebug.
Performance issue,Trouble encountered while debugging with xDebug.
Performance issue,Problem encountered while using xDebug for debugging purposes.
Performance issue,The xDebug tool causes issues during debugging.
Performance issue,Issue encountered while troubleshooting with xDebug.
Performance issue,Mistake encountered while debugging with xDebug.
Performance issue,The issue encountered while debugging with xDebug.
Performance issue,Issue encountered while troubleshooting with xDebug.
Performance issue,There was a problem while trying to debug with xDebug.
Performance issue,Issue encountered while troubleshooting with xDebug.
Performance issue,[Decorators] Application becomes unresponsive during project checkout.
Performance issue,'The UI becomes unresponsive when attempting to check out the project'
Performance issue,The user interface becomes unresponsive during project checkout.
Performance issue,"'When attempting to check out a project, the UI becomes unresponsive.'"
Performance issue,'The user interface becomes unresponsive when attempting to checkout the project'
Performance issue,'User interface experiences a halt during project checkout by decorators'
Performance issue,The user interface pauses during project checkout.
Performance issue,The user interface becomes unresponsive as it checks out the project.
Performance issue,The user interface freezes during the project checkout process.
Performance issue,'The user interface experiences a pause during project checkout.'
Performance issue,The user interface experiences a pause when attempting to checkout the project.
Performance issue,"Possible issue with calculations of Standard Disease Models, potential for underflow with very extreme parameters."
Performance issue,A possible problem with the calculation of Standard Disease Models could be the occurrence of an underflow error when dealing with particularly large or small values.
Performance issue,"Potential calculation error in Standard Disease Models, potential underestimation for extreme parameters."
Performance issue,"Possible coding error in calculation of Standard Disease Models, potential for underflow with extreme parameters."
Performance issue,A mistake in the calculation of Standard Disease Models may lead to potential underflow in situations with extreme parameters.
Performance issue,Possible underflow for extreme parameters could occur due to a computation error in the Standard Disease Models.
Performance issue,"Error in calculation of Standard Disease Models, potential underflow for unusual parameters."
Performance issue,'Possible error may occur when computing Standard Disease Models due to extreme parameters causing underflow issue.'
Performance issue,"Error in calculating Standard Disease Models, potential underestimation for very high or low parameters."
Performance issue,"There may be a potential issue with calculating Standard Disease Models due to a computational bug, which could result in an underflow for exceedingly high or low parameters."
Performance issue,"There is a potential error in the calculation of Standard Disease Models, which may result in a numerical underflow for extremely high or low parameters."
Performance issue,The JSP Editor is experiencing a memory leak after a few hours of working with JSP files.
Performance issue,The JSP editor experiences memory leakage after handling JSP files for a few hours.
Performance issue,The JSP editor exhibits memory leakage after several hours of working with JSP files.
Performance issue,The JSP Editor displays signs of a memory leak after several hours of working with JSP files.
Performance issue,The JSP editor experiences memory leakage after being utilized for a few hours with JSP files.
Performance issue,The JSP editor is experiencing memory leaks after being used for a couple of hours with JSP files.
Performance issue,The JSP editor is experiencing memory leakage after a few hours of working with JSP files.
Performance issue,The JSP Editor is experiencing memory leaks after being used for several hours with JSP files.
Performance issue,JSP Editor experiences memory leakage after working for a few hours with JSP files.
Performance issue,The JSP Editor experiences memory leakage after several hours working with JSP files.
Performance issue,The JSP editor is experiencing memory leakage after a few hours of working with JSP files.
Performance issue,An endless cycle occurs when attempting to set up a datapool using a CSV file that has commas within its fields.
Performance issue,A never-ending cycle occurs when attempting to set up a datapool using a CSV file that contains commas within its fields.
Performance issue,An endless cycle occurs while attempting to set up a datapool using a CSV file that contains commas within its fields.
Performance issue,An endless cycle is encountered while attempting to set up a datapool using a CSV file that includes commas within its fields.
Performance issue,An endless cycle occurs while attempting to set up a datapool using a CSV file that contains commas within its fields.
Performance issue,Continuous cycle when attempting to set up datapool using CSV file that includes commas within data fields.
Performance issue,Looping endlessly while attempting to set up datapool using a CSV file which includes commas within the fields.
Performance issue,An endless cycle occurs when attempting to set up a datapool using a CSV file that contains commas within its fields.
Performance issue,"""Endless cycle encountered while attempting to set up data pool using CSV file that includes embedded commas within fields."""
Performance issue,An endless cycle occurs when attempting to set up a datapool with a CSV file that includes commas within its fields.
Performance issue,An endless cycle occurs when attempting to set up a datapool using a CSV file that contains commas within its fields.
Performance issue,The newly purchased computer did not pass the testing phase due to an error being sent to its own PCTestAgent.
Performance issue,The newly acquired personal computer does not pass the testing phase as PCTestAgent reports an error back to itself.
Performance issue,"The recent PC did not pass the testing stage, as the PCTestAgent detected an error and reported it back to the system itself."
Performance issue,"The latest computer does not pass the testing stage, as the PCTestAgent detects an error and sends a notification to itself."
Performance issue,"The newly purchased computer does not pass the testing phase, as an error is detected by the PCTestAgent and reported back to the computer itself."
Performance issue,"The PCTestAgent reported an error to itself during testing, indicating that the new PC has failed."
Performance issue,"The latest personal computer does not pass the test with PCTestAgent, resulting in an error being sent to itself."
Performance issue,The latest computer unable to pass the test as PCTestAgent detects and reports an error to itself.
Performance issue,The latest computer does not pass the testing phase as the PCTestAgent reports an error to itself.
Performance issue,The recently purchased computer does not pass the testing process as the PCTestAgent detects an error and reports it back to itself.
Performance issue,The latest computer does not pass the testing stage as the PCTestAgent indicates an error to itself.
Performance issue,Worries surrounding performance in the system of application context
Performance issue,Issues regarding application performance in a system's context.
Performance issue,Worries about performance within the application environment platform
Performance issue,Issues regarding performance within the application context framework
Performance issue,Worries about how the system performs in the application context environment
Performance issue,Worries about functionality within the application environment.
Performance issue,Issues with performance in the application context environment.
Performance issue,Anxieties about performance within the environment of application context
Performance issue,Worries about functioning in the system of application settings.
Performance issue,There are anxieties related to the execution of tasks in the application environment system.
Performance issue,Worries about performance within the framework of the application system.
Performance issue,The freshly installed AC system is negatively affecting the environment of the newly executed process.
Performance issue,The introduction of a new air conditioning system is negatively impacting the environment of the newly launched process.
Performance issue,The latest air conditioner transfers poor surroundings to the current launch procedure.
Performance issue,The introduction of a new AC leads to the contamination of the environment in which the launching process takes place.
Performance issue,The implementation of a new air conditioning system negatively impacts the environment of the process that is being initiated.
Performance issue,The introduction of a fresh air conditioner contributes to a negative impact on the environment of the upcoming operation.
Performance issue,The introduction of a new AC transmits poor surroundings to the undergoing procedure.
Performance issue,The launch of a new air conditioning system results in a detrimental impact on the surrounding environment.
Performance issue,The newest air conditioning system contributes negatively to the environment of the launching procedure.
Performance issue,A fresh AC transmits negative surroundings to the initiated procedure.
Performance issue,The newly installed air conditioning system negatively affects the environment of the upcoming launch.
Performance issue,Object references are not gathered.
Performance issue,The act of collecting references to objects does not take place.
Performance issue,Object references are not reclaimed.
Performance issue,Items that refer to other objects are not retrieved.
Performance issue,Object references are not reclaimed.
Performance issue,References to objects are not gathered.
Performance issue,Object pointers are not eliminated.
Performance issue,The collection of object references does not occur.
Performance issue,Object pointers are not gathered.
Performance issue,'Object references are not gathered'
Performance issue,Object pointers are not gathered or accumulated.
Performance issue,There has been a decline in performance of (MON) GLA as reported by the downstream product.
Performance issue,Downstream product has reported a decrease in performance for (MON) GLA.
Performance issue,"(According to downstream product, (MON) GLA is experiencing a decrease in performance.)"
Performance issue,(A report has been made by a downstream product) that there is a decline in (MON) GLA's performance.
Performance issue,There has been a notification of performance decline in the downstream product due to (MON) GLA.
Performance issue,Decreased efficiency noted by downstream product due to (MON) GLA performance decline.
Performance issue,The downstream product has reported a decline in (MON) GLA performance.
Performance issue,A drop in performance for (MON) GLA has been reported by a product further down the line.
Performance issue,The downstream product has reported a decrease in performance of (MON) GLA.
Performance issue,A decrease in (MON) GLA efficiency has been notified by a subsequent product.
Performance issue,Downstream product reports performance decline of (MON) GLA.
Performance issue,"The SWT container gets stuck in a never-ending cycle, resulting in the failure of the NewClassCreationWizard."
Performance issue,"The SWT container enters an endless loop, causing the NewClassCreationWizard to fail."
Performance issue,The SWT container causes an endless repetition - NewClassCreationWizard is unsuccessful.
Performance issue,"The SWT container becomes stuck in a continuous cycle, causing the NewClassCreationWizard to fail."
Performance issue,The SWT container experiences an endless cycle - the creation of a new class fails in the NewClassCreationWizard.
Performance issue,The SWT container gets stuck in an endless cycle - The NewClassCreationWizard is unable to function.
Performance issue,"The SWT container enters an endless cycle, causing the failure of the NewClassCreationWizard."
Performance issue,"The SWT container gets stuck in an endless cycle, causing the NewClassCreationWizard to malfunction."
Performance issue,The SWT container enters an endless cycle causing the NewClassCreationWizard to not function properly.
Performance issue,The container of SWT gets stuck in an endless cycle - NewClassCreationWizard is not successful.
Performance issue,"The SWT container gets stuck in an endless cycle, causing the NewClassCreationWizard to malfunction."
Performance issue,'M9 profiling settings have not been utilized'
Performance issue,The M9 profiling choices were not utilized.
Performance issue,'M9 Profiling options were not utilized'
Performance issue,M9 Profiling preferences not utilized.
Performance issue,The M9 Profiling options were not utilized.
Performance issue,The profiling options for M9 were not implemented.
Performance issue,'M9 Profiling configurations not utilized'
Performance issue,The options for M9 Profiling were not utilized.
Performance issue,The M9 profiling options have not been implemented.
Performance issue,'M9 Profiling options were not utilized'
Performance issue,No M9 profiling options were utilized.
Performance issue,Evaluation: Enhance efficiency of duplicates.cgi; Revised Version 2
Performance issue,Assessment: Enhance the efficiency of duplicates.cgi; Revision v.2
Performance issue,'Review: Enhance the efficiency of duplicates.cgi; Patch version 2'
Performance issue,'Revision: Enhance duplicates.cgi efficiency; Update v.2'
Performance issue,'Assessment: Enhance efficiency of duplicates.cgi; Updated Patch with version 2'
Performance issue,'Review: Enhance functionality of duplicates.cgi; Updated Patch Version 2'
Performance issue,'Review: Enhance the efficiency of duplicates.cgi; Updated version 2 of the patch.'
Performance issue,'Review: Enhance the efficiency of duplicates.cgi; Revision version 2'
Performance issue,Critique: Enhance efficiency of duplicates.cgi; Update version 2
Performance issue,'Revision: Enhance the efficiency of duplicates.cgi; Update version 2 of the patch.'
Performance issue,Revised: Enhance duplicates.cgi efficiency; Second version of patch.
Performance issue,Several threads have been loaded.
Performance issue,Several threads have been loaded.
Performance issue,Multiple threads have been fully loaded.
Performance issue,Several threads have been loaded.
Performance issue,Numerous Threads Have Been Uploaded
Performance issue,Many threads are currently active.
Performance issue,Multiple threads have been loaded.
Performance issue,A variety of threads are being activated.
Performance issue,Several threads are loaded.
Performance issue,Numerous Threads Are Uploaded
Performance issue,Numerous threads have been initialized.
Performance issue,Mozilla quickly reiterates requests several times.
Performance issue,Mozilla quickly makes numerous requests repeatedly.
Performance issue,Mozilla quickly and frequently makes repeated requests.
Performance issue,'Mozilla quickly makes numerous repeated requests'
Performance issue,Mozilla quickly makes several repeated requests.
Performance issue,'Mozilla quickly reiterates multiple requests.'
Performance issue,Mozilla quickly makes repeated requests multiple times.
Performance issue,Mozilla swiftly iterates through requests frequently.
Performance issue,Mozilla quickly makes multiple requests repeatedly.
Performance issue,Mozilla quickly duplicates its requests multiple times.
Performance issue,Mozilla repeats requests multiple times with great speed.
Performance issue,There is a memory leak issue occurring on the website www.bhun.net.
Performance issue,A problem with memory overflow on the website www.bhun.net.
Performance issue,Possible paraphrase: There is a memory leak issue present on the website www.bhun.net.
Performance issue,"Possible paraphrase: ""There is a memory leak occurring on the website www.bhun.net."""
Performance issue,There is a memory leak occurring on the website www.bhun.net.
Performance issue,The website www.bhun.net is experiencing a memory leak.
Performance issue,There is a problem with a memory leak occurring on the website www.bhun.net.
Performance issue,There is a memory overflow occurring on the website www.bhun.net.
Performance issue,Potential issue with memory storage on the website www.bhun.net.
Performance issue,A memory leakage has occurred on the website www.bhun.net.
Performance issue,Possible paraphrase: Defect in memory allocation on the website www.bhun.net
Performance issue,[Enhancement] Improve loading speed of bookmarks.html
Performance issue,[Task] Increase the loading speed of bookmarks.html.
Performance issue,[Enhancement] Increase the loading time of bookmarks.html
Performance issue,[Performance] Enhance the loading time of bookmarks.html
Performance issue,[Enhancement] Increase the speed of loading bookmarks.html file
Performance issue,'Enhance the loading time of bookmarks.html'
Performance issue,[Improvement] Increase the loading time of bookmarks.html.
Performance issue,[Enhancement] Increase the loading speed of bookmarks.html.
Performance issue,[Efficiency] Increase the rate at which bookmarks.html is loaded.
Performance issue,'Enhance the loading speed of bookmarks.html'
Performance issue,'Optimize the loading time of bookmarks.html'
Performance issue,It may require multiple reloads for the web page to completely load.
Performance issue,It may require multiple reloads for the webpage to completely load.
Performance issue,It requires multiple refreshes for the website to fully load.
Performance issue,It may require multiple attempts to fully load the webpage.
Performance issue,It requires multiple reloads for the web page to fully load.
Performance issue,It may take multiple reloads for the web page to completely load.
Performance issue,It may require multiple page refreshes before the website is fully loaded.
Performance issue,It takes multiple loads for the webpage to fully load.
Performance issue,It may require multiple attempts for the webpage to completely load.
Performance issue,It may require multiple attempts before the webpage fully loads.
Performance issue,It may require multiple reloads for the webpage to completely load.
Performance issue,Evaluation of Necko's Performance
Performance issue,Evaluation of Necko's Performance
Performance issue,'Evaluation of Necko's Performance'
Performance issue,Evaluation of Necko's Performance
Performance issue,Performance Assessment at Necko
Performance issue,'Evaluation of Necko's Performance'
Performance issue,Evaluation of Necko's Performance
Performance issue,Evaluation of Necko's Performance
Performance issue,Review of Necko's Performance
Performance issue,'Evaluation of Necko's Performance'
Performance issue,'Reviewing Necko's Performance'
Performance issue,"Decrease the size of debug logs in the browser-chrome, which may otherwise exceed the maximum size and result in the closure of trunk and aurora trees."
Performance issue,Make debug browser-chrome logs smaller to avoid exceeding the maximum log size and causing closure of trunk and aurora trees.
Performance issue,"Minimize the size of error logs generated by browser testing, preventing them from exceeding the maximum limit and causing the trunk and aurora tree branches to be shut down."
Performance issue,Decrease the size of debug browser-chrome logs to prevent them from exceeding the maximum log size and causing trunk and aurora trees to close.
Performance issue,Minimize the debug browser-chrome logs to avoid surpassing the maximum log capacity and consequently halting the operations of the trunk and aurora trees.
Performance issue,"Decrease the size of debug logs for the browser-chrome, preventing them from exceeding the maximum size and causing a closure of the trunk and aurora branches."
Performance issue,Decrease the size of debug browser-chrome logs to prevent them from exceeding the maximum size and therefore causing the trunk and aurora trees to close.
Performance issue,Minimize the size of browser-chrome logs for debugging purposes to avoid surpassing the maximum log limit which can result in the closure of the trunk and aurora tree branches.
Performance issue,"Minimize the dimensions of debug logs for browser-chrome, preventing them from surpassing the allowed log size and causing trunk and aurora trees to shut down."
Performance issue,"Decrease the size of debug logs for browser-chrome, which are currently too large and causing the trunk and aurora trees to close due to exceeding the maximum log size."
Performance issue,"Minimize the length of the debug logs for browser-chrome, which may cause the trunk and aurora branches to close due to exceeding the allowed log size."
Performance issue,B2G-Inbound has been shut down because of ICS Emulator Debug Mochitests Leaks that have been detected in a majority of the tests.
Performance issue,The B2G-Inbound system has been shut down because of ICS Emulator Debug Mochitests Leaks which were present in a majority of the tests.
Performance issue,B2G-Inbound shut down because of ICS Emulator Debug Mochitests causing leaks in a majority of the tests.
Performance issue,B2G-Inbound has been shut down because the ICS Emulator Debug Mochitests have resulted in leaks in a majority of the tests.
Performance issue,The closure of B2G-Inbound is a result of ICS Emulator Debug Mochitests Leaks found in the majority of the tests.
Performance issue,"The B2G-Inbound has been shut down because of ICS Emulator Debug Mochitests' leaks, which have been detected in the majority of the tests."
Performance issue,The B2G-Inbound has been shut down as a result of ICS Emulator Debug Mochitests revealing leaks in a majority of the tests.
Performance issue,The B2G-Inbound has been shut down because of ICS Emulator Debug Mochitests Leaks that were detected in majority of the tests.
Performance issue,The B2G-Inbound has been shutdown as a result of ICS Emulator Debug Mochitests causing leaks in the majority of the tests.
Performance issue,The B2G-Inbound has been shut down as a result of ICS Emulator Debug Mochitests Leaks appearing in the majority of the tests.
Performance issue,'B2G-Inbound has been shut down because of ICS Emulator Debug Mochitests Leaks being present in a majority of the tests.'
Performance issue,"When a substantial script is loaded in the Rhino debugger, it can cause an infinite loop, resulting in 100% utilization of the CPU."
Performance issue,"When a considerable script is loaded into the Rhino debugger, it leads to an infinite cycle (100% CPU usage)."
Performance issue,"When loading a substantial script in the Rhino debugger, it leads to an everlasting loop which completely utilizes the CPU (100% usage)."
Performance issue,"When a substantial script is loaded into the Rhino debugger, it leads to a continuous cycle (100% of the CPU is being used)."
Performance issue,"When a significant script is loaded in the Rhino debugging tool, it leads to a continuous cycle with 100% of the CPU being utilized."
Performance issue,"When a sizable script is loaded into the Rhino debugger, it causes a continuous cycle that uses up all of the CPU (100% utilization)."
Performance issue,"When a sizable script is loaded in the Rhino debugger, an infinite loop occurs causing the CPU to run at maximum capacity (100% utilization)."
Performance issue,"When a substantial script is loaded into the Rhino debugger, it causes a continuous cycle (maxing out the CPU at 100%)."
Performance issue,"When a sizable script is loaded into the Rhino debugger, it causes a continual cycle (100% CPU usage)."
Performance issue,The Rhino debugger will continuously loop and use 100% of the computer's CPU when a sizeable script is being loaded.
Performance issue,"When a sizable script is loaded into the Rhino debugger, it leads to an infinite loop and uses up 100% of the CPU."
Performance issue,numerous process divisions
Performance issue,extensive amount of stages
Performance issue,A considerable amount of process divisions.
Performance issue,A considerable amount of process divisions.
Performance issue,Numerous processing divisions
