Classification,Summary
Database-related issue,The SQL function is not compatible with Informix IDS 9.2.
Database-related issue,The SQL task is not compatible with Informix IDS 9.2.
Database-related issue,The SQL task is not compatible with Informix IDS 9.2.
Database-related issue,The SQL assignment is not compatible with Informix IDS 9.2.
Database-related issue,The SQL task is not compatible with Informix IDS 9.2.
Database-related issue,The SQL task is not compatible with Informix IDS 9.2.
Database-related issue,The SQL task is not compatible with Informix IDS 9.2.
Database-related issue,The SQL task is not compatible with Informix IDS 9.2.
Database-related issue,The SQL task is not compatible with Informix IDS 9.2.
Database-related issue,The SQL assignment is not functional on Informix IDS version 9.2.
Database-related issue,The SQL task is incompatible with Informix IDS 9.2.
Database-related issue,The SQL task is incompatible with Informix IDS 9.2.
Database-related issue,The outcome of the Bugzilla search is incorrect.
Database-related issue,The results displayed by Bugzilla's search function are inaccurate.
Database-related issue,The Bugzilla search outcome is inaccurate.
Database-related issue,The outcome of a Bugzilla search is inaccurate.
Database-related issue,The Bugzilla search outcome is inaccurate.
Database-related issue,The findings on Bugzilla do not seem to be accurate.
Database-related issue,The Bugzilla search results are inaccurate.
Database-related issue,The Bugzilla search outcome is inaccurate.
Database-related issue,The search outcome in Bugzilla is inaccurate.
Database-related issue,The outcome retrieved from Bugzilla's search does not appear to be accurate.
Database-related issue,The search results from Bugzilla are inaccurate.
Database-related issue,The search results from Bugzilla are not accurate.
Database-related issue,The Bugzilla search outcome is not accurate.
Database-related issue,The selection options (radio buttons and table) in the ConnectionFilterPropertyPage should be deactivated for database connection profiles.
Database-related issue,The selection section (consisting of selection radio buttons and selection tables) in the ConnectionFilterPropertyPage should not be available for use with database connection profile items.
Database-related issue,The selection portion (selection radio/selection table) of the ConnectionFilterPropertyPage must be deactivated for database connection profiles.
Database-related issue,The segment of the ConnectionFilterPropertyPage that involves choosing between options (through radio buttons or a table) should be made unavailable for profiles pertaining to connecting to databases.
Database-related issue,The selection radio/selection table in the ConnectionFilterPropertyPage must be deactivated for database connection profiles.
Database-related issue,The segment of the ConnectionFilterPropertyPage that pertains to selecting a database connection profile must be deactivated.
Database-related issue,"The ConnectionFilterPropertyPage's selection section, including the selection radio and selection table, should be deactivated for database connection profiles."
Database-related issue,The ConnectionFilterPropertyPage's selection section (selection radio/selection table) should be deactivated for the database connection profiles.
Database-related issue,"The ""Selection"" section (containing a radio button or table) on the ConnectionFilterPropertyPage must be deactivated for database connection profile items."
Database-related issue,"The component in ConnectionFilterPropertyPage, namely the selection section (selection radio/selection table), should be deactivated for database connection profiles."
Database-related issue,The allocation segment (allocation wireless transmission/allocation grid) in ConnectionFilterPropertyPage must be deactivated for database connection profile entities.
Database-related issue,"The selection section, specifically the selection radio and selection table, on the ConnectionFilterPropertyPage should be deactivated for profiles related to database connections."
Database-related issue,The selection section (which includes selection radio and selection table) on the ConnectionFilterPropertyPage must be deactivated for database connection profile objects.
Database-related issue,"A comparable api, ""allowQuotedDML()"", is required for the database."
Database-related issue,Require an identical api called allowQuotedDML() for the database.
Database-related issue,It is necessary to have a comparable allowQuotedDML() interface for databases.
Database-related issue,"""Require a comparable allowQuotedDML() application programming interface for the database."""
Database-related issue,A comparable api for allowing quoted DML() is required for the database.
Database-related issue,"""An equivalent database api, the allowQuotedDML() function, is required."""
Database-related issue,A comparable API on the database for the usage of allowQuotedDML() is needed.
Database-related issue,An equivalent database api called allowQuotedDML() is required.
Database-related issue,An API that mimics allowQuotedDML() should be implemented for the database.
Database-related issue,"'Require an equivalent API, allowQuotedDML(), to be available for utilization on the database.'"
Database-related issue,'Require an equivalent allowQuotedDML() application programming interface (API) for database use.'
Database-related issue,Require a comparable allowQuotedDML() application programming interface on the database.
Database-related issue,We require a comparable allowQuotedDML() interface for our database.
Database-related issue,"If the database is disconnected, the sql cannot be executed."
Database-related issue,Unable to execute the sql query when there is a disconnection from the database.
Database-related issue,The SQL will not be executed if the database is disconnected.
Database-related issue,"In the event of a database disconnection, the sql execution will be unsuccessful."
Database-related issue,Unsuccessful execution of SQL if the database is disconnected.
Database-related issue,"If the database is disconnected, the sql will not be executed."
Database-related issue,The sql could not be executed if the database is not connected.
Database-related issue,Unable to execute the sql when the database is disconnected.
Database-related issue,"If a disconnection occurs, the SQL will not be able to execute correctly."
Database-related issue,"If the database is disconnected, the SQL will not be executed."
Database-related issue,The sql cannot be executed if the database is disconnected.
Database-related issue,"If the database is disconnected, the sql will not successfully run."
Database-related issue,"If the database is not connected, the sql will not be executed successfully."
Database-related issue,An error with the database name containing a hyphen leads to a connection failure.
Database-related issue,A hyphen in the database name causes the connection to fail.
Database-related issue,"If there is a hyphen in the database name, it will cause the connection to fail."
Database-related issue,"Having a special character (such as ""-"") in the database name will cause the connection to fail."
Database-related issue,Having a symbol '-' in the database name causes the connection to fail.
Database-related issue,The presence of a hyphen in the database's name will cause the connection to fail.
Database-related issue,A dash in the database's name can lead to a connection failure.
Database-related issue,An apostrophe in the database title causes the connection to fail.
Database-related issue,An error in the database name causes the connection to fail.
Database-related issue,A hyphen in the database name can cause the connection to fail.
Database-related issue,An occurrence of a hyphen in the database name results in a disruption of the connection.
Database-related issue,The presence of a hyphen in the database name causes the connection to fail.
Database-related issue,Including a hyphen in the name of the database causes the connection to fail.
Database-related issue,[Patch for incorporation of Marketplace Database Connections in app.class.php]
Database-related issue,"This patch, implemented in [app.class.php], introduces enhancements for connecting to the Marketplace Database."
Database-related issue,'[app.class.php] Enhancement to include connections to the Marketplace Database'
Database-related issue,A modification was made to [app.class.php] in order to include connections to the Marketplace Database.
Database-related issue,This patch is aimed at incorporating Marketplace Database Connections into the [app.class.php] file.
Database-related issue,The added patch to [app.class.php] includes the establishment of Marketplace Database Connections.
Database-related issue,[app.class.php] Modification to incorporate Marketplace Database Connections
Database-related issue,[app.class.php] Modification to incorporate Marketplace's Database Connections
Database-related issue,'[app.class.php] Update for including Marketplace Database Connections'
Database-related issue,"""Patch for including Marketplace Database Connections in [app.class.php]"""
Database-related issue,Modification to include connections to Marketplace databases in the [app.class.php] file.
Database-related issue,'The [app.class.php] file has been modified to include Marketplace Database Connections.'
Database-related issue,Modification made to [app.class.php] in order to incorporate Marketplace Database Connections.
Database-related issue,A problem concerning Action in the Symptom Database Editor.
Database-related issue,A problem related to Action in Symptom Database Editor.
Database-related issue,A problem encountered in the Symptom Database Editor regarding its Action feature.
Database-related issue,A problem concerning Action in the Symptom Database Editor.
Database-related issue,A problem encountered while using Action in Symptom Database Editor.
Database-related issue,There is a concern related to the functioning of the Action feature in the Symptom Database Editor.
Database-related issue,A problem regarding Action within the Symptom Database Editor.
Database-related issue,A problem encountered in the Symptom Database Editor dealing with Action.
Database-related issue,There is a problem regarding Action in the Symptom Database Editor.
Database-related issue,A problem regarding Action in the Symptom Database Editor.
Database-related issue,A problem related to taking action in the Symptom Database Editor.
Database-related issue,A problem has arisen with the operation of Action in the Symptom Database Editor.
Database-related issue,A problem concerning Action in the Symptom Database Editor.
Database-related issue,'EDT endorses a wider range of database suppliers.'
Database-related issue,The use of EDT is expanding to include additional database providers.
Database-related issue,EDT assists a wider range of database providers.
Database-related issue,EDT offers assistance to a greater number of database providers.
Database-related issue,EDT provides assistance to a wider range of database providers.
Database-related issue,EDT offers assistance to an increased number of database suppliers.
Database-related issue,'EDT provides backing for a wider range of database providers'
Database-related issue,EDT provides assistance to a broader range of database providers.
Database-related issue,EDT offers support for a wider range of database providers.
Database-related issue,EDT offers assistance to a wider range of database providers.
Database-related issue,EDT provides assistance to a wider range of database providers.
Database-related issue,The use of EDT is extended to include a wider range of database vendors.
Database-related issue,EDT backs multiple database providers.
Database-related issue,'An issue occured while exporting the Symptom Database which includes GB18030 characters.'
Database-related issue,There was an issue while exporting the Symptom Database that resulted in an encoding error for GB18030 characters.
Database-related issue,There was a mistake in encoding when attempting to export a Symptom Database that includes characters from the GB18030 set.
Database-related issue,An issue with encoding occurred when attempting to export the Symptom Database which includes GB18030 characters.
Database-related issue,"There was a mistake in encoding when attempting to export the Symptom Database, which also includes characters in the GB18030 format."
Database-related issue,An issue occurred when exporting the Symptom Database which includes characters in the GB18030 format.
Database-related issue,An encoding issue occurred during the exporting of the Symptom Database which contains characters in GB18030 format.
Database-related issue,"An encoding issue occurred during the export of the Symptom Database, which includes GB18030 characters."
Database-related issue,"An issue was encountered while transferring the Symptom Database, which includes characters in the GB18030 format, causing an encoding error."
Database-related issue,A mistake with encoding occurred when exporting the Symptom Database which includes GB18030 characters.
Database-related issue,"There was a problem with encoding when exporting the Symptom Database, which includes characters in GB18030 format."
Database-related issue,An error occurred when exporting the GB18030 character-containing Symptom Database due to encoding issues.
Database-related issue,An issue with encoding occurred while exporting the Symptom Database which includes characters in GB18030 format.
Database-related issue,Batch mode does not terminate Database Cursors.
Database-related issue,"When utilizing Batch mode, Database Cursors are left open."
Database-related issue,"'According to the tweet, when utilizing Batch mode, Database Cursors remain open and are not closed.'"
Database-related issue,"When Batch mode is utilized, Database Cursors are not properly closed."
Database-related issue,"'Retweet: When utilizing Batch mode, Database Cursors remain open and are not closed.'"
Database-related issue,'Retweet: The closure of Database Cursors is not executed while employing Batch mode.'
Database-related issue,"RT: When utilizing Batch mode, Database Cursors remain open and are not closed."
Database-related issue,"In batch mode, database cursors remain open and are not closed."
Database-related issue,The closing of Database Cursors is not done when Batch mode is utilized.
Database-related issue,Database Cursors remain open when Batch mode is utilized.
Database-related issue,"In Batch mode, Database Cursors are not terminated."
Database-related issue,"Cursors in databases are kept open when utilizing Batch mode, according to RT."
Database-related issue,"When using Batch mode, the database cursors are not properly closed."
Database-related issue,The desirable location for the Symptom Database preference page is within the Profiling and logging section.
Database-related issue,The preferred location for the Symptom Database preference page is under the Profiling and logging section.
Database-related issue,The option for the Symptom Database should be located within the Profiling and Logging section.
Database-related issue,The designation for the Profile and Log section is where the Symptom Database preference page ought to be located.
Database-related issue,The page for selecting Symptom Database should fall within the Profiling and Logging category.
Database-related issue,The ideal location for the Symptom Database preference page would be situated within the Profiling and logging section.
Database-related issue,The page for Symptom Database preference should fall within the category of Profiling and Logging.
Database-related issue,The preferred location for the Symptom Database preference page is under the Profiling and logging section.
Database-related issue,The preference page for the Symptom Database should be located within the Profiling and Logging section.
Database-related issue,The page for selecting a preferred Symptom Database should fall within the Profiling and Logging section.
Database-related issue,The preference page for the Symptom Database ought to fall within the Profiling and Logging category.
Database-related issue,The choice for the Symptom Database preference page ought to be located within the Profiling and Logging section.
Database-related issue,The Optimal Location for the Symptom Database Preferences Page is within the 'Profiling and Logging' Section.
Database-related issue,A problem regarding Regionalized Language in Symptom Database Editing Tool
Database-related issue,A Problem with Restricted Note in Symptom Database Tool
Database-related issue,A problem has arisen regarding the localized message within the Symptom Database editor.
Database-related issue,A problem concerning localized messages in the Symptom Database editor.
Database-related issue,'A Problem with Regionalized Message in Symptom Database editor'
Database-related issue,An problem regarding regionalized messaging in the Symptom Database editor.
Database-related issue,A problem with customizing messages in the Symptom Database editor.
Database-related issue,A problem with specific message in database editor for symptoms.
Database-related issue,A Problem Regarding Regionalized Messages in Symptom Database Editor
Database-related issue,A problem has arisen concerning the localized message in the Symptom Database editor.
Database-related issue,There is a problem involving message localization in the Symptom Database editor.
Database-related issue,A problem with personalized notification in the Symptom Database editing tool.
Database-related issue,A Problem with Specific Message in Symptom Database Editor
Database-related issue,The function to select the Database Name in the Editor drop down menu for setting the profile is not functioning properly.
Database-related issue,The option to select a Database Name in the Editor drop down menu for the profile setting is not functioning properly.
Database-related issue,The option to choose a Database Name in the Set Profile for Editor drop-down menu is not functioning properly.
Database-related issue,The option to choose a Database Name in the Editor drop down for Profile setting is malfunctioning.
Database-related issue,The function to select the Database Name in the Editor drop down does not function properly.
Database-related issue,The selection of the Database Name in the Editor drop down menu for the Profile Setting is not functioning.
Database-related issue,The dropdown menu for selecting the database name in the Editor profile setting is not functioning properly.
Database-related issue,The function to choose a Database Name in the Editor drop down menu for Profile Settings is not functioning properly.
Database-related issue,The option to choose a Database Name from the Editor drop down does not function properly.
Database-related issue,The option to choose a Database Name in the Editor drop down menu for Profile settings does not function properly.
Database-related issue,The function for selecting a Database Name in the Editor drop down for the Profile setting does not function correctly.
Database-related issue,The option to choose a Database Name in the Editor drop down for setting a Profile is not functioning.
Database-related issue,The function to specify the profile for the editor's drop down database name selection is not functioning properly.
Database-related issue,The Database root in the Data Source Explorer view has a dialog that is empty.
Database-related issue,The dialog on the Database root's properties section within the Data Source Explorer view does not contain any information.
Database-related issue,The Data Source Explorer view has a blank dialog when accessing the properties of the Database root.
Database-related issue,The Database root in the Data Source Explorer view has an empty dialog box when opened.
Database-related issue,The properties section on the root of the Database in the Data Source Explorer view is currently empty.
Database-related issue,The Data Source Explorer view displays an empty dialogue box when accessing the properties of the Database root.
Database-related issue,The Database root in the Data Source Explorer displays a blank dialog for its properties.
Database-related issue,"""In the Data Source Explorer view, the properties for the Database root are currently displayed as a empty dialog."""
Database-related issue,The Data Source Explorer display - characteristics on primary Database lacks content in the dialogue box.
Database-related issue,The properties for the Database root in the Data Source Explorer view are shown in an empty dialogue box.
Database-related issue,The Data Source Explorer view contains a Database root with an empty dialog for properties.
Database-related issue,The Database root in the Data Source Explorer view has an empty dialog for its properties.
Database-related issue,The Database root in the Data Source Explorer view does not have any information displayed in its properties dialog.
Database-related issue,The resources for binding SQL databases should prevent users from creating duplicate names.
Database-related issue,SQL database binding should not allow users to make duplicate names when creating resources.
Database-related issue,The resources for binding SQL databases must prevent users from generating duplicate names.
Database-related issue,The utilization of SQL database resources must prohibit users from generating identical names.
Database-related issue,SQL database resources should prevent users from creating duplicate names.
Database-related issue,The utilization of resources for binding SQL databases should prevent users from generating duplicate names.
Database-related issue,"""Resources for binding databases in SQL should prevent users from creating duplicate names."""
Database-related issue,Users should not be able to create duplicate names when binding resources in an SQL database.
Database-related issue,It is imperative that SQL database binding resources prevent users from generating duplicate names.
Database-related issue,'Resources for binding SQL databases should prevent users from generating duplicate names.'
Database-related issue,The creation of duplicate names by users should be prevented by resources binding to SQL databases.
Database-related issue,'Prevent users from duplicating names when binding SQL database resources.'
Database-related issue,Users must not be allowed to generate identical names when utilizing resources for binding a SQL database.
Database-related issue,The error notification for creating records from an SQL database remains unresolved.
Database-related issue,The error notification for generating records from the SQL database remains unresolved.
Database-related issue,The error message for creating records from an SQL database remains unremovable.
Database-related issue,The error message for creating new records from an SQL database remains unresolved.
Database-related issue,The error notification for generating records from the SQL database is not removed.
Database-related issue,The error message for creating records from an SQL database remains unchanged.
Database-related issue,The error alert for generating entries from the SQL database does not disappear.
Database-related issue,The error notification for creating records from an SQL database remains unresolved.
Database-related issue,The error notification for creating records from an SQL database remains unresolved.
Database-related issue,The error notification for generating records from the SQL database remains persistent.
Database-related issue,The error notification for creating records from an SQL database is not removed.
Database-related issue,The error message for creating records from the sql database remains persistent.
Database-related issue,The error notification for generating records from the SQL database remains unresolved.
Database-related issue,The attempt to update the database containing issues has been unsuccessful.
Database-related issue,The attempt to revise the issues database is unsuccessful.
Database-related issue,The attempt to refresh the issues database is unsuccessful.
Database-related issue,The attempt to refresh the problems database is unsuccessful.
Database-related issue,The attempt to refresh the issues database is unsuccessful.
Database-related issue,The attempt to revise the issues database is unsuccessful.
Database-related issue,The attempt to update the database of issues is unsuccessful.
Database-related issue,Failure in updating the issues database.
Database-related issue,The attempt to refresh the issues database is unsuccessful.
Database-related issue,The updating process of the issues database is unsuccessful.
Database-related issue,The updating process of the problem database is unsuccessful.
Database-related issue,The attempt to refresh the issues database is unsuccessful.
Database-related issue,The failure to update the database of issues has occurred.
Database-related issue,"If an incorrect database type is chosen, the test connection does not provide any response."
Database-related issue,"If an incorrect database type is chosen, the Test Connection feature does not provide any response."
Database-related issue,"The ""Test Connection"" feature does not provide any indication if an incorrect database type is chosen."
Database-related issue,The feature of Test Connection does not provide any response if an incorrect database type is chosen.
Database-related issue,"The ""Test Connection"" feature does not provide any response when an incorrect database type is chosen."
Database-related issue,The incorrect selection of database type will not receive any response from the Test Connection function.
