Classification,Summary
GUI-related issue,"If no profiling has been chosen, the user interface needs to set the TRACE_MODE to ""none""."
GUI-related issue,"If there is no profiling chosen, the user interface should assign the TRACE_MODE as ""none""."
GUI-related issue,"If no profiling is chosen, the user interface must designate the TRACE_MODE as ""none""."
GUI-related issue,Widgets without any text will not be visible on Composite with GridLayout.
GUI-related issue,Widgets that lack text will not appear on the Composite with a GridLayout.
GUI-related issue,Widgets without any accompanying text do not appear on the Composite with a GridLayout.
GUI-related issue,The app that was launched with Composite and Gridlayout is not displaying the controls.
GUI-related issue,The application that was started with a Composite and Gridlayout does not display the controls.
GUI-related issue,The application that was launched with Composite and Gridlayout does not display the controls.
GUI-related issue,The Graph Viewer is experiencing issues with correctly positioning the SWT ToolItem figure.
GUI-related issue,The image for the SWT ToolItem is not properly placed within the graph viewer.
GUI-related issue,The ToolItem figure in the graph viewer does not appear in the correct position.
GUI-related issue,The act of creating a profile to file does not result in files that comply with UTF-8 standards.
GUI-related issue,The process of creating a profile to a file does not result in the production of UTF-8 compatible files.
GUI-related issue,Saving the profile as a file does not produce files that are compatible with UTF-8.
GUI-related issue,Issues encountered while configuring the BoxLayout beneath a TabbedPane.
GUI-related issue,Issues configuring BoxLayout within a TabbedPane
GUI-related issue,Issues encountered while configuring BoxLayout within a TabbedPane
GUI-related issue,'MoreSwingComponents not displaying correctly'
GUI-related issue,'Malfunction in the display of MoreSwingComponents'
GUI-related issue,Insufficient display of MoreSwingComponents
GUI-related issue,The editor is unable to open and generates Null Pointer Exceptions.
GUI-related issue,The editor is unable to open and thus causes NullPointerExceptions to occur.
GUI-related issue,The editor is unable to open and throws a NullPointerException.
GUI-related issue,The update for the snippet is being implemented during the top-down updates.
GUI-related issue,"During updates from the top, the snippet update is taking effect."
GUI-related issue,The activating of snippet updates while conducting top down updates.
GUI-related issue,Making changes to RCP Mail results in codegen producing mistakes in syntax.
GUI-related issue,"When modifying RCP Mail, codegen produces syntax mistakes."
GUI-related issue,Modifying RCP Mail results in codegen producing incorrect syntax.
GUI-related issue,Problem identified by Probekit is not translated in Filters Customization of TVT 3.1 and TCT 545.
GUI-related issue,"TVT version 3.1 is correlated to TCT 545, where a problem identified by a probe kit remains unaddressed in the customization of filters."
GUI-related issue,The issue identified by the Probekit in customizing filters has not been translated in TVT 3.1 and TCT 545.
GUI-related issue,"The page ""TVT 3.1 - About > Plugins"" displays a list of all the plug-ins available, including the ones labeled "" #%plugin.name."""
GUI-related issue,"""TVT 3.1 - About > Plugins"" section displays a list of plug-ins labeled as "" #%plugin.name."""
GUI-related issue,"The section for plug-ins on TVT 3.1, titled ""About > Plugins,"" lists the names of the plug-ins as "" #%plugin.name."""
GUI-related issue,Unable to include Equivalence classes into the dataset.
GUI-related issue,Not able to include equivalence classes in the datapool.
GUI-related issue,Not able to include equivalent groups in the data pool.
GUI-related issue,"'Refresh' in the view of Profiling Monitor, without saving agent(s) that were lost during active attachment."
GUI-related issue,Update the Profiling Monitor view without storing any discarded active attach agent(s).
GUI-related issue,'Renew' the Profiling Monitor view without preserving any detached attach agent(s).
GUI-related issue,Contributing properties of the action object for Log Node/Correlations.
GUI-related issue,Log Node/Correlations' contributing impact on action object properties.
GUI-related issue,'Log Node/Correlations' properties' influence on the action of the object and its contribution.
GUI-related issue,"""Making sure that the GraphNode is visible does not result in its selection being displayed."""
GUI-related issue,The selection is not displayed when using the function ensureVisible on a GraphNode.
GUI-related issue,The selection is not displayed when using the ensureVisible() function on a GraphNode.
GUI-related issue,TargetVM does not update.
GUI-related issue,TargetVM does not update.
GUI-related issue,TargetVM will not refresh.
GUI-related issue,"On certain occasions, the contents of the Console may be cleared during the process of profiling."
GUI-related issue,There are instances where the Console's contents are erased during profiling.
GUI-related issue,"On occasions, the Console's data may be erased during profiling."
GUI-related issue,The latest Visual Class wizard enables the extension of Composite which results in poor quality code and the occurrence of errors.
GUI-related issue,The newly introduced Visual Class wizard expands the Composite generation and detects faulty code and errors.
GUI-related issue,The latest Visual Class wizard enhances the Composite functionality and minimizes the occurrence of faulty code and errors.
GUI-related issue,Removing filled TabFolders results in the editor becoming unresponsive until the remote Virtual Machine reaches its timeout limit.
GUI-related issue,"When a populated TabFolder is deleted, the editor will become unresponsive and remain in that state until the remote virtual machine times out."
GUI-related issue,Removing a filled TabFolder results in the editor becoming unresponsive until the remote virtual machine reaches its timeout.
GUI-related issue,Issues with configuring and implementing styles in modeling using SWT ToolItem
GUI-related issue,Difficulties with developing and determining styles using SWT ToolItem
GUI-related issue,Issues with using ToolItems in SWT while attempting to model and apply different styles.
GUI-related issue,The UI editparts in CardLayout are not displayed accurately by the Pause/Reload function.
GUI-related issue,The CardLayout function does not accurately showcase the user interface edits for the Pause or Reload options.
GUI-related issue,The Pause/Reload function does not present the UI editparts accurately when using CardLayout.
GUI-related issue,Altering location markers does not result in GUI modifications for JVECDGEN01.
GUI-related issue,The GUI does not get updated when the location annotations are modified.
GUI-related issue,Modifying location notes does not prompt GUI to refresh  JVECDGEN01
GUI-related issue,'Ease of access: Tabular details for method invocation cannot be reached solely using keyboard commands'
GUI-related issue,'Usability: Keyboard-only users cannot access the method invocation details table.'
GUI-related issue,Accessible: Keyboard-only access not available for method invocation details table.
GUI-related issue,The manual test execution application is not capable to have its text read by a screen reader for accessibility purposes.
GUI-related issue,The manual test execution application is not readable by the screen reader.
GUI-related issue,"The manual test execution application is not readable by the screen reader, making it inaccessible."
GUI-related issue,"Refreshing a soiled editor prompts the cache to be updated, even if the document was not saved."
GUI-related issue,Refreshing a soiled editor prompts the cache to be updated despite the file not being saved.
GUI-related issue,"'Refreshing a contaminated editor leads to the cache being updated, despite the file not being saved.'"
GUI-related issue,Encountering NPE while using Customize Layout dialogue and switching between tabs in a TabFolder.
GUI-related issue,'Customization of layout and tab transition in TabFolder causing NPE'
GUI-related issue,The occurrence of NPE when using the Customize Layout dialog and changing tabs in a TabFolder.
GUI-related issue,The occurrence of extensive Composites is caused by SWT Launcher.
GUI-related issue,The use of SWT Launcher results in significant Composites.
GUI-related issue,The use of SWT Launcher results in substantial Composites.
GUI-related issue,Improper Arrangement of Swing Elements
GUI-related issue,Mistaken Placement of Swing Elements
GUI-related issue,Improper Arrangement of Swing Elements
GUI-related issue,"""Alter the Location Property on JVELAYT01, but if you reverse the change, the control will no longer be hidden."""
GUI-related issue,'JVELAYT01: Alter Location Attribute and Revert Causes Control to Become Concealed'
GUI-related issue,Updating the Location Property for JVELAYT01 results in the control being hidden when the Undo command is executed.
GUI-related issue,The SWT renderer is incapable of handling bar charts with horizontal or stacked horizontal orientation.
GUI-related issue,The horizontal bar and horizontal stack bar charts are not supported by the SWT renderer.
GUI-related issue,The horizontal bar and horizontal stack bar charts are not compatible with the SWT renderer.
GUI-related issue,The TVT3.1 software issue where the 416-BIDI icon does not appear flipped in the product-PDE.
GUI-related issue,TVT3.1: The tct 416-BIDI symbol does not appear inverted in the product-PDE.
GUI-related issue,TVT3.1: The tct 416-BIDI icon is not reversed on the product-PDE.
GUI-related issue,Transform post_bug.cgi into a template.
GUI-related issue,Create a template for the post_bug.cgi function.
GUI-related issue,Create a template for post_bug.cgi
GUI-related issue,Transform process_bug.cgi into a template.
GUI-related issue,Transform process_bug.cgi into a template.
GUI-related issue,Make the process_bug.cgi into a template.
GUI-related issue,Conduct an evaluation of the FILTER usage in the show_bug.html.tmpl file.
GUI-related issue,Perform an examination of show_bug.html.tmpl to check for any instances of FILTER being used.
GUI-related issue,Conduct an examination of the code in show_bug.html.tmpl to identify the utilization of FILTER.
GUI-related issue,Revised: 'Evaluation: Incorporate <label> into email preferences; Version 2: Revise with account/prefs/email.html.tmpl'
GUI-related issue,'Reviewed: Incorporate <label> into email preferences; Version 2: Revise by referencing account/prefs/email.html.tmpl'
GUI-related issue,'Evaluation: Incorporate <label> into email preferences; v2: Revise based on account/prefs/email.html.tmpl template.'
GUI-related issue,'review: The radiobuttons in search/knob.html.tmpl should incorporate the <label> element; v2: Implement <label> for the check/radiobuttons in search/knob.html.tmpl'
GUI-related issue,"The review suggests that the search/knob.html.tmpl file includes the use of <label> tags for the radio buttons. In the revised version (v2), <label> tags have been added to the check/radiobuttons in the search/knob.html.tmpl file."
GUI-related issue,'review: Modify the use of <label> in search/knob.html.tmpl to include radiobuttons; v2: Incorporate <label> for the check/radiobuttons in search/knob.html.tmpl'
GUI-related issue,"""Revising: The bug/create/create.html.tmpl review calls for the implementation of <label>; A patch has been submitted for the group permission checkboxes in bug/create/create.html.tmpl."""
GUI-related issue,'Review: The bug/create/create.html.tmpl file should incorporate the use of <label> for the group permission checkboxes; A patch has been proposed for this issue.'
GUI-related issue,'Critique: The bug/create/create.html.tmpl file needs to incorporate <label>; Correction for the group permission checkboxes in bug/create/create.html.tmpl'
GUI-related issue,"""Evaluation: The file attachment/*.tmpl must utilize <label>; Version 1: Update the ./edit.html.tmpl and ./create.html.tmpl files in the ./attachment/* directory."""
GUI-related issue,"Edit required for ./attachment/* templates to include <label>, based on review of v1. Modifications needed for ./edit.html.tmpl and ./create.html.tmpl."
GUI-related issue,'Review requested for: Using <label> in attachment/*.tmpl; Version 1: Make modifications to ./edit.html.tmpl and ./create.html.tmpl within the ./attachment/* directory.'
GUI-related issue,"Revised: Improve efficiency by changing ""all selected"" to ""none selected"" in Patch v.2 review."
GUI-related issue,"Revised: Enhance efficiency by changing from ""all selected"" to ""none selected""; Modified version v.2"
GUI-related issue,"""Enhancement: Transform ""all selected"" to ""none selected"" to improve efficiency; Revised patch version 2."""
GUI-related issue,"In order to improve efficiency, the suggested change is to switch the option from ""all selected"" to ""none selected"". This has been implemented in Patch version 3."
GUI-related issue,"""Enhancement: Increase efficiency by changing 'all selected' to 'none selected'; Patch version 3"""
GUI-related issue,"Critique: Enhance efficiency by changing ""all selected"" to ""none selected""; Update version 3."
GUI-related issue,"Review: Optimize by changing ""all selected"" to ""none selected""; Patch version 3."
GUI-related issue,"""Efficiency improved by changing 'all selected' to 'none selected' in Patch v.3."""
GUI-related issue,"Modification: Transform ""all chosen"" to ""none chosen"" for increased efficiency; Update version 3."
GUI-related issue,"'Assessment: After selecting ""And"", the button labeled ""Add another boolean chart"" is displayed twice; this is addressed in Patch v.1'"
GUI-related issue,"After selecting ""And"", the ""Add another boolean chart"" button is displayed twice; Analysis v.1"
GUI-related issue,"A review was done on Patch v.1 and it was discovered that the button labeled ""Add another boolean chart"" appears twice whenever the ""And"" button is clicked."
GUI-related issue,Unexpected error occurs while modifying the status of a bug that has dependencies.
GUI-related issue,Encountering an error while attempting to modify the status of a bug that is reliant on other issues.
GUI-related issue,A bug with dependencies may cause a crash when attempting to alter its status.
GUI-related issue,"Triggering a flag (either from the attached information or during the attachment upload) leads to an ""Undetected bug identification."""
GUI-related issue,"Choosing a flag (either from the attachment information or during the process of attaching a file) leads to an outcome of ""Absent bug identification."""
GUI-related issue,"Triggering a flag (either from the attached information or during the attachment upload process) leads to the occurrence of an ""Absent bug ID""."
GUI-related issue,A summary of the changes made in Patch v.1 includes adding additional <link> elements and making the navigation links more template-friendly.
GUI-related issue,Evaluation: Enhanced <link> components & implementation of navigation_links template; Update version 1
GUI-related issue,Summary: Evaluation of Additional <link> Elements and Navigation Link Templating in Patch v.1
GUI-related issue,GIF is not suitable as a link.
GUI-related issue,The link provided does not function as a GIF.
GUI-related issue,GIF is not suitable for use as a link.
GUI-related issue,Links with relevant titles are shown above the arrows of the scroll bar.
GUI-related issue,Titles for Related Links are visible above the arrows for the scroll bar.
GUI-related issue,The over scroll bar arrows display titles of related links.
GUI-related issue,The menu accesskey (shortcut key) information must be present in the DTD.
GUI-related issue,The information for the accesskey (shortcut key) on the menu should be included in the DTD.
GUI-related issue,'The information for the accesskey (keyboard shortcut) of the menu should be included in the DTD.'
GUI-related issue,"Display previously hidden inline elements, such as named anchors, in the editor."
GUI-related issue,"""Allow typically vacant inline elements (such as named anchors) to be visible in the editor."""
GUI-related issue,Show typically blank inline elements (such as named anchors) in the editor.
GUI-related issue,The HTML content section refreshes completely when hovering over a hyperlink.
GUI-related issue,"""The whole HTML section will be refreshed when hovering over a hyperlink."""
GUI-related issue,"When hovering over a link, the entire HTML content section is repainted."
GUI-related issue,The alignment of horizontal lines is not accurate on top of a table that is floating.
GUI-related issue,The alignment of horizontal lines is not accurate when placed over a floating table.
GUI-related issue,Floating tables cause horizontal lines to be positioned off-center.
GUI-related issue,Italicized text is assessed and rendered with incorrect measurements.
GUI-related issue,Italics are improperly measured and displayed.
GUI-related issue,There are errors in the measurement and rendering of italics.
GUI-related issue,The text of buttons is not displayed if HTML strict and CSS height are being used.
GUI-related issue,Buttons' text is not displayed when HTML strict and CSS height are used.
GUI-related issue,The text of buttons is not visible when HTML strict and CSS height are utilized.
GUI-related issue,Javascript cannot alter images across frames.
GUI-related issue,Javascript cannot alter image across frames.
GUI-related issue,Javascript cannot alter image across frames.
GUI-related issue,The recommended fonts for the Baltic region are exclusively iso-8859-4.
GUI-related issue,The proposed fonts for Baltic languages are exclusively iso-8859-4.
GUI-related issue,The proposed Baltic typefaces are limited to iso-8859-4 only.
GUI-related issue,"Sun's copy, cut, and paste function is not functioning on the HTML editor."
GUI-related issue,"The functionality of the Copy, Cut, and Paste keys on Sun's HTML Editor is currently not functioning."
GUI-related issue,The Copy/Cut/Paste function on the Sun's HTML Editor does not function.
GUI-related issue,Not including semicolons after escape characters results in the browser crashing.
GUI-related issue,The absence of semicolons on escape characters can cause the browser to stop functioning properly.
GUI-related issue,The absence of semicolons in escape characters can lead to a crash in the browser.
GUI-related issue,The ALL frame of the homepage is not eligible for the use of character coding.
GUI-related issue,The character encoding cannot be used for the entire homepage frame.
GUI-related issue,It is not possible to implement character encoding on the entire homepage.
GUI-related issue,'Establishing image origin through DOM techniques no longer functional'
GUI-related issue,Changing the image URL using DOM methods is now ineffective.
GUI-related issue,'Setting the image's source through DOM methods is currently dysfunctional.'
GUI-related issue,The titles and links related to CJK displayed nonsensical content on the Sidebar Related Links section.
GUI-related issue,The titles and links for CJK languages in the Sidebar Related Links were shown as gibberish.
GUI-related issue,"'Chinese, Japanese, and Korean titles/links on the Related Links section on the Sidebar were showing jumbled content.'"
GUI-related issue,"The ""View Original"" function in the auto translate feature results in a blank page being displayed."
GUI-related issue,The functionality of automatically translating a feature to display the original version is currently resulting in a blank page.
GUI-related issue,"The ""View Original"" function on the auto translate feature displays a blank webpage."
GUI-related issue,"Due to a malfunctioning html form select, it is currently not possible to utilize Bugzilla for the purpose of reporting, updating, or querying bugs."
GUI-related issue,"The HTML form select feature is not functioning properly, thus preventing the use of Bugzilla for reporting, updating, and querying bugs."
GUI-related issue,"Due to a malfunction in the HTML form select, the use of Bugzilla for reporting, updating, or querying bugs is currently unavailable."
GUI-related issue,Mistakes in filling out the form on bug pages (form submitted incorrectly)
GUI-related issue,Erroneous submission of forms on bug pages (incorrect form provided)
GUI-related issue,The improper submission of forms on bug pages (incorrect form was submitted).
GUI-related issue,There is a bug identified as 594553 causing issues with shadow layers on android.
GUI-related issue,The android shadow layers have been disrupted due to a bug identified as 594553.
GUI-related issue,"The functionality of shadow layers on android has been disrupted due to a bug, specifically bug 594553."
GUI-related issue,The virtual keyboard will cover the entire screen due to bug 860318.
GUI-related issue,The bug 860318 causes the virtual keyboard to occupy the entire screen.
GUI-related issue,The complete display being affected by bug 860318 resulting in a virtual keyboard.
GUI-related issue,The Bugzilla helper is not functioning properly.
GUI-related issue,The functionality of Bugzilla helper is not working correctly.
GUI-related issue,The functionality of Bugzilla helper is not functioning properly.
GUI-related issue,Any text enclosed between < and > will not be visible in bugmail.
GUI-related issue,Words enclosed in < and > are not visible in bug-related emails.
GUI-related issue,Text enclosed in < > tags is not visible in bugmail.
GUI-related issue,Typing a # symbol in the designated SMTP auth username box causes the SMTP server's name to vanish from the dropdown menu on the SMTP server (Mozilla Mail 1.3).
GUI-related issue,Typing a hashtag symbol in the textbox for SMTP authentication username causes the SMTP server name to disappear from the dropdown list of servers in Mozilla Mail 1.3.
GUI-related issue,Typing a # symbol in the username field for SMTP authentication leads to the SMTP server's name disappearing from the dropdown menu of the SMTP server in Mozilla Mail 1.3.
GUI-related issue,Incorrect support for the <IFRAME> element.
GUI-related issue,'The <IFRAME> element is not functioning properly.'
GUI-related issue,The <IFRAME> element not functioning properly.
GUI-related issue,"""Email and News | Account Settings | Cancel->Cancel"""
GUI-related issue,'Correspondentie en Actualiteiten | Accountopties | Stop -> Beindigen'
GUI-related issue,Mail and News | Account Settings | Cancel -> Cancel
GUI-related issue,The top of the browser window on Mac experiences a loss of 4 pixels.
GUI-related issue,'4 pixels at the top of the browser window are lost by Mac'
GUI-related issue,There is a loss of 4 pixels in the top area of the Mac's browser window.
GUI-related issue,"When the pull-down menu is selected, a gray dotted border will encircle it, as well as the submit buttons."
GUI-related issue,A faded gray border is displayed surrounding the perimeter of the dropdown menu and the submit buttons.
GUI-related issue,"When viewing the pull-down menu and submit buttons, a faint gray outline can be seen surrounding their edges."
GUI-related issue,"The initial dropdown menu at the top; when an item is chosen from this menu and the go button is clicked, the host is not continuously resolved."
GUI-related issue,"The initial drop-down menu at the top; when an item is chosen from this menu and the go button is clicked, the host is not consistently resolved."
GUI-related issue,"""The menu located at the top, first in the list; upon choosing an item from this menu and clicking the go button, the host is not continuously resolved."""
GUI-related issue,"According to JA, the destination page of the third link from the bottom seems to have been relocated."
GUI-related issue,"According to the third link from the bottom, it seems that the intended page on Rakuten has been relocated."
GUI-related issue,The third link from the bottom on the page for Rakuten seems to have been relocated.
GUI-related issue,There are a pair of eBay URLs that share the same title.
GUI-related issue,There are two identical eBay links under the name JA:PR2.
GUI-related issue,JA:PR2 contains two identical eBay hyperlinks
GUI-related issue,Typo in the name of the DE:PR1 eBay item found in the drop-down menu
GUI-related issue,Incorrect spelling found for eBay item on dropdown menu
GUI-related issue,Typographical error in the eBay item selection drop-down list for DE:PR1.
GUI-related issue,"""The list of DE:PR1 eBay items in the drop-down menu is not sorted in alphabetical order."""
GUI-related issue,The eBay items in the pull-down section are not organized in alphabetical order.
GUI-related issue,The items in the pull-down menu of eBay under DE:PR1 are not organized in alphabetical order.
GUI-related issue,"Please modify the text to say ""Revise the ""Events"" option in the eBay drop-down menu to ""Highlights""."""
GUI-related issue,"Modify the text by replacing ""Events"" with ""Highlights"" in the eBay dropdown menu."
GUI-related issue,"Modify the current option ""Events"" in the eBay drop-down menu to ""Highlights""."
GUI-related issue,"The issue of searching within the ""investorworld-Finanzcommunity"" on DE:PR1."
GUI-related issue,"The issue of searching for ""investorworld-Finanzcommunity"" on DE:PR1 needs to be addressed."
GUI-related issue,"Problem with searching for ""investorworld-Finanzcommunity"" on DE:PR1."
GUI-related issue,The Arrow image next to the 'Anmelden' appears to be positioned too high in Investor World.
GUI-related issue,From: 'Investor World' Website; The arrow icon beside the 'Sign In' button is positioned too high.
